codigo,nombre_completo,correo,telefono,semestre,horas_semanales,fecha_inicio
1151234,Juan Carlos Pérez López,juan.perez@ufps.edu.co,3001234567,8,20,2025-01-15
1157890,María Fernanda García Ruiz,maria.garcia@ufps.edu.co,3009876543,6,20,2025-01-15
1155678,Carlos Andrés Rodríguez Sánchez,carlos.rodriguez@ufps.edu.co,3001112233,7,20,2025-01-15
1159876,Ana Sofía Martínez Torres,ana.martinez@ufps.edu.co,3005556666,5,20,2025-01-15
1152345,Luis Eduardo González Vásquez,luis.gonzalez@ufps.edu.co,3007778888,9,20,2025-01-15